title;
天丝羊毛蕾丝V领背心女加宽肩带一体式罩杯打底内搭秋冬保暖内衣;
Nui Organics Merino Tencel Uncle Al tee in Mallard/ Navy size 3;
商场同款MM麦檬春秋新款外套女天丝风衣女长款5998169072 米色5998169072 160/84A/M;
NWT Eileen Fisher White Tencel Stretch Box-Top Size L/G;
Emico TENCEL ชุดรอมเปอร์ เพลย์สูท แบบสั้น มีซิป สําหรับเด็ก;
BNWT Burgandy / Black Spot Slim Fit Tencel Top By tu Size 16 Cotton Modal Elasta;
Style & Co Women's Drawstring Tencel Skort Med Gray Size Large;
Luxe Summer Lycra Tencel Shirt;
BRAVADO! DESIGNS Sustainable Full Cup Maternity & Nursing Bra | Original | Organic Cotton & Tencel™ Modal Blend | Wireless | DD/E - J Cup;
Q21天丝棉儿童家居服睡衣男孩女童夏季薄款透气排汗抑菌上衣单件;
Sass And Bide Floppy Shapes White Tencel Tee Tshirt Top. Size M;
小耳出品【闭眼入一打】38%莱赛尔30%亚麻T恤女短袖圆领套头女装;
Summer Preppy Style Pleated Denim Skirt with Sashes Fairycore Aesthetic A-line Mini Cargo Skirts Korean Fashion Clothing Girl;
Kaos Polos Premium WHYCOTTON Tencel™ Katun Modal UNISEX (NATURAL;
TFTO 주니어텐셀메쉬브리프(THYUUP11);
大码天丝牛仔半身裙女夏季薄款高腰显瘦垂感开叉中长款a字包臀裙;
HAMAKO V Patch Basic Tee / Kaus Anak Tencel;
Max Jeans Gray Tencel Jacket Size S Flower Embroidered;
Burberry London Button Down Dress Shirt Size XL Gray Made In Tencel Lyocell;
麗嬰房天絲護肚褲（90 公分）;
plus Size Women's Summer Thin High Waist Loose Wide Leg Jeans Casual Style Zipper Closure Straight Cut Tencel Denim Pants;
Tencel Thin Denim Shorts Men's Fashion Brand Ice Silk Overweight People plus Size Fifth Pants Summer Fat Guy Elastic Drawstring Pants;
GIORDANO Women Dresses Crewneck Short Sleeve Summer Tencel Shirt Dresses Stretch Fashion Comfort Casual Pleated Dresses 05463343;
에어로쿨 메쉬 텐셀 남성기본런닝;
Eileen Fisher Grey and White Striped Tunic Tencel Women's Size Medium;
EILEEN FISHER Tencel Jersey Top S Semi Sheer Short Sleeve Shirttail Black USA;
Bowknot Crop Top Smooth Tencel Sun Protection Shirt Versatile Bottom ing Shirt;
Tommy Bahama Pants Mens 32 Golf Stretch Chinos Khakis Golfing Cotton/Tencel;
(사모아)실크촉감 여성 나시 끈 런닝;
Modal Short-Sleeved T-Shirt Women's Spring/Summer 2024 New Arrival Tight Backless Tencel Thin Shoulder Low Collar Half Sleeve Tops;
